{
  "$schema": "https://json-schema.org/draft/2020-12/schema",
  "$id": "https://eduharness.local/schemas/skill-contract.schema.json",
  "title": "Skill Typed I/O Contract (NOOA-1, WP-1 core)",
  "description": "Machine-readable, deterministic input/output contract for a Brain skill. Complements (does not replace) SKILL.md prose. Authored as JSON (not YAML) because the F:\\eduHarness harness is dependency-free (no js-yaml, no ajv) and parses contracts with Node's native JSON.parse. `requires`/`optional` bind the skill to host execution primitives declared in a runtime's `host_capabilities` (harness/schemas/host-capability-profile.schema.json, WP-6); check-host-capabilities.mjs resolves them and yields CAPABILITY_UNAVAILABLE when a required primitive is not `available` on the target runtime.",
  "type": "object",
  "required": ["schema_version", "skill_id", "inputs"],
  "additionalProperties": false,
  "properties": {
    "schema_version": {"const": 1},
    "skill_id": {
      "type": "string",
      "pattern": "^[a-z0-9]+(?:-[a-z0-9]+)*$",
      "description": "Canonical skill id; matches brain/skills/<id> and skill-registry canonical_id."
    },
    "source_of_truth": {
      "type": "string",
      "description": "Relative path to the SKILL.md this contract is derived from."
    },
    "requires": {
      "type": "array",
      "uniqueItems": true,
      "items": {"enum": ["filesystem.read", "filesystem.write", "shell", "code_execution", "browser", "subagents", "mcp"]},
      "description": "Host execution primitives the skill cannot run without. Each must be `available` on the target runtime's host_capabilities, else CAPABILITY_UNAVAILABLE."
    },
    "optional": {
      "type": "array",
      "uniqueItems": true,
      "items": {"enum": ["filesystem.read", "filesystem.write", "shell", "code_execution", "browser", "subagents", "mcp"]},
      "description": "Primitives the skill can use if present but does not require; a missing optional primitive never blocks."
    },
    "inputs": {
      "type": "object",
      "minProperties": 1,
      "additionalProperties": {"$ref": "#/$defs/input"},
      "description": "Map of input name to its typed definition."
    },
    "outputs": {
      "type": "object",
      "additionalProperties": false,
      "properties": {
        "artifacts": {
          "type": "array",
          "items": {"$ref": "#/$defs/artifact"}
        }
      }
    }
  },
  "$defs": {
    "input": {
      "type": "object",
      "required": ["type", "required"],
      "additionalProperties": false,
      "properties": {
        "type": {"enum": ["string", "integer", "number", "boolean", "array"]},
        "required": {"type": "boolean"},
        "enum": {"type": "array", "minItems": 1},
        "minimum": {"type": "number"},
        "description": {"type": "string"}
      }
    },
    "artifact": {
      "type": "object",
      "required": ["path", "required"],
      "additionalProperties": false,
      "properties": {
        "path": {"type": "string", "minLength": 1},
        "required": {"type": "boolean"},
        "condition": {"type": "string", "description": "Human-readable condition under which a non-required artifact is produced."}
      }
    }
  }
}
